{
  "opera_riferimento": {
    "titolo": "Le città di pianura",
    "autore": "Francesco Sossai"
  },
  "domanda_di_partenza": "Perché l'iniziazione di Giulio si compie come separazione e non come eredità? Che tipo di trasmissione lega i due cinquantenni al giovane, se non un sapere e non un mondo da prendere in carico? Quale configurazione umana del film rende possibile — e necessario — questo esito di distacco?",
  "momenti_salienti": [
    {
      "titolo_sintetico": "L'intuizione del mondo che resta in piedi senza più sostenere nessuna vita",
      "step_di_provenienza": "step_2",
      "descrizione": "Già nella prima lettura, mettendo in relazione tre elementi del dossier — l'esito narrativo descritto come 'iniziazione conclusa per separazione', la sequenza delle case 'Vendesi', l'antefatto della fuga di Genio collocato attorno alla crisi del 2008 — è emersa una temperatura precisa: il film non parla di rovina o catastrofe, ma di erosione lenta di un mondo che continua a stare in piedi. Le case non sono macerie, sono presenze fissate. Da qui è uscita l'ipotesi che la fedeltà dei due cinquantenni al proprio codice non sia scelta culturale né resistenza politica, ma sopravvivenza dell'orientamento dopo che il campo che lo sosteneva si è eroso.",
      "impatto_sul_percorso": "Questa intuizione ha orientato tutta l'analisi successiva nella direzione di una lettura strutturale e non psicologica dei due cinquantenni. Ha tolto dal tavolo, fin dall'inizio, la lettura clinica (alcolismo, fissazione, regressione) come riduttiva, e ha spostato il baricentro dalla 'malinconia per un Veneto perduto' alla configurazione formale di un mondo postumo abitato da figure residuali."
    },
    {
      "titolo_sintetico": "Il Brion come modello formale e non come citazione",
      "step_di_provenienza": "step_3",
      "descrizione": "Durante la lettura strutturata, la tappa al Memoriale Brion ha presentato una difficoltà: leggerla come riferimento colto (giovane studente di architettura davanti al capolavoro di Scarpa) sembrava insoddisfacente rispetto al peso che le fonti le attribuiscono. L'ipotesi che si è imposta è che il Brion non funzioni come scenografia simbolicamente carica, ma come modello formale segreto dell'intero film: un'architettura che pensa la perdita come tenuta, non come spiegazione né come consolazione. Da quel momento la pellicola analogica, le case in vendita, la fedeltà dei mentori al codice, l'attesa di Genio sono diventati leggibili come specchi d'acqua che riflettono la perdita senza superarla — parti di una stessa forma.",
      "impatto_sul_percorso": "È stata la scoperta più produttiva del percorso. Ha trasformato la lettura da accostamento di temi a riconoscimento di una configurazione formale unitaria. La separazione, da esito narrativo, è diventata principio architettonico del film. La tesi finale della 'trasmissione obliqua' ha qui il suo perno: il Brion fornisce al film la forma di ciò che gli accade — un'iniziazione come architettura della separazione, non dell'integrazione."
    },
    {
      "titolo_sintetico": "Le assenze come dato critico",
      "step_di_provenienza": "step_3",
      "descrizione": "Tre nodi attesi non si sono attivati nel film, e questa assenza è risultata strutturalmente parlante. Manca una dinamica di colpa-riparazione legata all'antefatto illecito di Genio: i due cinquantenni non fanno i conti con il passato, lo custodiscono. Manca un'autorità educativa esplicita: i mentori sono disautorizzati, periferici, e la trasmissione che avviene è iniziatica per esperienza condivisa, non normativa. Manca, infine, una simbolizzazione discorsiva esplicita della perdita: nessun personaggio elabora a parole il lutto del mondo finito.",
      "impatto_sul_percorso": "Le assenze hanno funzionato come controprove della configurazione individuata. La mancata attivazione della dinamica colpa-riparazione ha confermato che la perdita è in gioco sul piano della separazione e del limite, non del vincolo affettivo trasformato. L'assenza dell'autorità educativa ha precisato che cosa il film fa quando mette in scena una trasmissione: non la educazione, ma il riconoscimento. L'assenza di simbolizzazione discorsiva ha confermato la coerenza fra il film e il Brion: tenere il resto non simbolizzabile come tale è un atto formale, non un'omissione narrativa."
    },
    {
      "titolo_sintetico": "La resistenza alla patologizzazione dei cinquantenni",
      "step_di_provenienza": "step_3",
      "descrizione": "Nel registrare la formula 'mai saltare l'ultimo bicchiere' come dispositivo del film, è stata necessaria una scelta interpretativa esplicita: leggere il rituale ripetuto come investimento esclusivo del desiderio (asse 5, nodo 'desiderio fissato'), non come patologia individuale. La distinzione richiede di tenere insieme due cose: il fatto che la fissazione è effettivamente una concentrazione difensiva del desiderio, e il fatto che questa concentrazione è risposta razionale all'erosione di un campo storico, non sintomo di fragilità psicologica. Si è scelto di tenere aperta l'ambivalenza — dignitosa e problematica al tempo stesso — senza dirimerla in nessuna delle due direzioni.",
      "impatto_sul_percorso": "Questa scelta ha dato al testo finale uno dei suoi tratti più marcati: il rifiuto di una lettura clinica e il rifiuto di una lettura idealizzante. La sezione sull'ultimo bicchiere è costruita esattamente attorno a questa ambivalenza tenuta. È anche il punto in cui la traduzione fenomenologia → analisi culturale ha richiesto la cautela più esplicita: il vocabolario del desiderio fissato è categoria strutturale, non diagnosi."
    },
    {
      "titolo_sintetico": "La precisazione finale: la trasmissione è trasmissione di un riconoscimento",
      "step_di_provenienza": "step_4",
      "descrizione": "La formulazione della tesi nella sua versione finale ha richiesto un'ultima messa a fuoco. La prima lettura parlava di un giovane che si lascia 'attraversare quanto basta' dal mondo dei mentori per riorientarsi altrove. In sede di sintesi conclusiva è emerso che questa formulazione era ancora troppo strumentale: faceva del mondo dei due cinquantenni una tappa funzionale al percorso di Giulio. La precisazione decisiva è stata identificare che cosa esattamente passi tra mentori e allievo: non un contenuto (sapere, memoria, permesso, norma) ma un riconoscimento — atto simultaneamente cognitivo, affettivo e temporale, che si trasmette solo a chi sa staccarsene.",
      "impatto_sul_percorso": "È la precisazione che ha permesso di leggere la separazione finale come forma stessa della trasmissione, e non come modo in cui la trasmissione fallisce. Da qui è emersa anche la generosità del film verso i propri protagonisti adulti: il finale non li condanna a essere superati, non li promuove a maestri, li lascia esattamente dove sono. Questo punto è ciò che distingue la lettura proposta da una lettura redentiva o da una lettura disillusa: il film tiene aperta una terza posizione che il vocabolario degli assi ha permesso di nominare."
    }
  ],